PO Number,Vendor name,Posting date,PO Balance,PO Total Amount
4500024056,TRUSTAR ENTERPRISE,2025-01-01,2580.0,30960.0
4500024057,SRI TELIPOT FOTOSTAT,2025-01-01,0.0,6000.0
4500024063,TM BUILDERS SDN BHD,2025-01-02,4190.0,50280.0
4500024065,NASHKAWI SECURITY SERVICES,2025-01-02,8517.31,99802.37
4500024066,NLC GENERAL PEST CONTROL SDN BHD,2025-01-02,0.0,1944.0
4500024070,TK ELEVATOR MALAYSIA SDN BHD,2025-01-02,648.0,7776.0
4500024072,LASERGAIN SDN BHD,2025-01-02,450.0,5400.0
4500024073,HARAHAP MAJU PEST CONTROL SDN BHD,2025-01-02,559.0,3354.0
4500024074,YIMIDA RESOURCES SDN BHD,2025-01-02,3195.0,12780.0
4500024077,KELAB SUKAN DAN KEBAJIKAN,2025-01-02,1350.0,19800.0
4500024078,KOPERASI STAF CIDB MALAYSIA BERHAD,2025-01-02,6210.0,71300.0
4500024079,KEDAI SERBANEKA FAFA,2025-01-02,875.0,6630.0
4500024081,MULTICLEAN SERVICES (SABAH) SDN BHD,2025-01-02,1200.0,2880.0
4500024082,AKADEMI BINAAN MALAYSIA (JOHOR),2025-01-02,0.0,205468.2
4500024083,CONSONANCE SOLUTION SDN BHD,2025-01-02,0.0,6360.0
4500024084,COWAY (MALAYSIA) SDN BHD,2025-01-02,0.0,1584.0
4500024085,RENTOKIL INITIAL (M) SDN BHD,2025-01-02,0.04,2589.6
4500024086,PERFECT OFFICE SYSTEM SDN BHD,2025-01-03,529.2,6036.8
4500024090,RICOH (MALAYSIA) SDN. BHD.,2025-01-03,1944.0,22464.0
4500024091,RICOH (MALAYSIA) SDN. BHD.,2025-01-03,972.0,11232.0
4500024092,ISBA BERSIH SDN BHD,2025-01-03,2538.0,30456.0
4500024095,DAYACOP SECURITY SERVICES SDN BHD,2025-01-03,13992.92,83957.52
4500024097,KOPERASI STAF CIDB MALAYSIA BERHAD,2025-01-03,17690.4,203112.0
4500024101,RENTOKIL INITIAL (M) SDN BHD,2025-01-03,179.55,2154.6
4500024102,CHUAH YEE ZEEN,2025-01-03,17600.0,105600.0
4500024103,KANGAR OFFICE AUTOMATION &,2025-01-03,556.8,5952.0
4500024104,MECACOM TECHNOLOGIES SDN BHD,2025-01-05,1450.0,17400.0
4500024105,ORION RIGEL STARS SECURITY SDN BHD,2025-01-06,7339.06,87449.12
4500024106,KOPERASI STAF CIDB MALAYSIA BERHAD,2025-01-06,0.0,97960.0
4500024107,NUR RINA ENTERPRISE,2025-01-06,3376.0,40286.0
4500024108,KOPERASI STAF CIDB MALAYSIA BERHAD,2025-01-06,0.0,97321.4
4500024113,HORNET SECURITY SDN BHD,2025-01-06,0.0,92969.88
4500024114,SINAR LAGI ENGINEERING,2025-01-06,0.0,5920.0
4500024115,ERA PISA ENTERPRISE,2025-01-06,0.0,9901.44
4500024117,ITPS MARKETING SDN BHD,2025-01-06,19654.0,19654.0
4500024122,SINDOH MARKETING (M) SDN BHD,2025-01-06,0.0,7200.0
4500024124,LICENTOKIL (M) SDN. BHD,2025-01-06,0.0,4600.0
4500024128,CONSONANCE SOLUTION SDN BHD,2025-01-06,0.0,16224.0
4500024132,KOPERASI STAF CIDB MALAYSIA BERHAD,2025-01-06,7590.0,8250.0
4500024134,PUTRAPACK MOVERS SDN. BHD.,2025-01-06,10225.7,35106.95
4500024135,PROFIL UNGGUL SDN BHD,2025-01-06,2797.2,33566.4
4500024136,KOPERASI STAF CIDB MALAYSIA BERHAD,2025-01-06,37415.8,431750.0
4500024138,COWAY (MALAYSIA) SDN BHD,2025-01-06,132.0,1584.0
4500024146,VECTOR PROTECTION,2025-01-07,280.0,3360.0
4500024147,GRACIOUS JEWEL SDN BHD,2025-01-07,0.0,284205.6
4500024148,MSZ SEPAKAT PEST CONTROL,2025-01-07,0.0,1800.0
4500024150,WINNING FORCE SECURITY SERVICES,2025-01-07,4757.2,68343.26
4500024151,KOPERASI STAF CIDB MALAYSIA BERHAD,2025-01-07,0.0,32240.0
4500024154,SIMDO SDN BHD,2025-01-08,7787.31,93444.31
4500024157,TOSHIBA TEC MALAYSIA SDN BHD (ACCOU,2025-01-08,0.0,4992.0
4500024167,PUTRAPACK MOVERS SDN. BHD.,2025-01-08,4062.2,37166.0
4500024170,ONE ALLIANCE OFFICE,2025-01-08,1400.0,8400.0
4500024171,D'ANAZ ENTERPRISE,2025-01-08,1500.0,18000.0
4500024172,RED BERET SECURITY SDN BHD,2025-01-08,6719.76,80637.12
4500024173,TRG.TYPEWRITER SDN BHD,2025-01-08,855.0,10260.0
4500024174,DOL TWO ENTERPRISE,2025-01-08,5627.5,65836.8
4500024175,INDASIA SECURITY SERVICES SDN BHD,2025-01-08,7826.55,86091.98
4500024176,DAYTHREE BUSINESS SERVICES SDN BHD,2025-01-09,41571.75,572093.44
4500024177,HEALTHMETRICS SDN BHD,2025-01-09,2370.6,21600.0
4500024180,ARANCIA RESOURCES,2025-01-09,10000.0,10000.0
4500024182,PASSION ANTHEM SDN BHD,2025-01-09,10000.0,10000.0
4500024184,MEKAR INDAH JADI,2025-01-09,8827.7,97104.74
4500024186,SIGMA ELEVATOR (M) SDN BHD,2025-01-09,950.4,11404.8
4500024188,CIDB TECHNOLOGIES SDN BHD,2025-01-10,0.0,192090.0
4500024189,LIEW AIRCONDITIONING WORKS,2025-01-10,4110.0,32680.0
4500024199,FIZO INTEGRATED SOLUTIONS,2025-01-12,904.5,7076.0
4500024225,COWAY (MALAYSIA) SDN BHD,2025-01-14,240.0,5136.0
4500024227,COWAY (MALAYSIA) SDN BHD,2025-01-14,0.0,19500.0
4500024228,KOPERASI STAF CIDB MALAYSIA BERHAD,2025-01-14,0.0,10171.0
4500024229,KOPERASI STAF CIDB MALAYSIA BERHAD,2025-01-14,3707.6,5308.0
4500024231,KOPERASI STAF CIDB MALAYSIA BERHAD,2025-01-14,12606.25,18000.0
4500024232,MALMO ENTERPRISE,2025-01-14,600.0,5700.0
4500024233,STYLIZED MENS WEAR SDN. BHD.,2025-01-14,300.0,900.0
4500024257,ROYALIST SUPPLIES & TRADING CO.,2025-01-16,350.0,3500.0
4500024260,HASRAT IMPIAN ENTERPRISE,2025-01-16,145.0,24000.0
4500024262,EVERGROW RJ GENERAL CONTRACTOR,2025-01-16,2872.8,34473.6
4500024263,EXPERT SECURITY SERVICES SDN BHD,2025-01-16,8300.88,98820.0
4500024264,KIWI OFFICE EQUIPMENT SALES & SERVI,2025-01-16,176.0,2112.0
4500024284,WATER TECH ENTERPRISE,2025-01-20,400.0,1200.0
4500024288,WAWASAN OFFICE & STUDENT STATION,2025-01-20,5105.6,6542.92
4500024297,WORDLABS GLOBAL SDN BHD,2025-01-21,392.0,127400.0
4500024307,INFINITE SUCCESS CONSTRUCTION,2025-01-22,2808.0,30672.0
4500024323,PUTRAPACK MOVERS SDN. BHD.,2025-01-27,3335.8,40034.0
4500024331,KAMAL NEWS AGENT,2025-01-28,1689.0,4000.0
4500024333,MUAFFAQ ENTERPRISE,2025-01-31,34049.24,151525.56
4500024335,TERMINEX PEST CONTROL SDN. BHD.,2025-01-31,5200.0,22800.0
4500024351,SENI PUJAAN SDN BHD,2025-02-04,46000.0,46000.0
4500024360,ABZA ENTERPRISE SARAWAK,2025-02-04,45756.0,76260.0
4500024367,DAPAT VISTA (M) SDN BHD,2025-02-04,88307.23,108000.0
4500024373,KELAB REKREASI DAN SUKAN CIDB 23,2025-02-05,1650.0,18150.0
4500024375,KOPERASI STAF CIDB MALAYSIA BERHAD,2025-02-06,5826.8,57099.2
4500024379,CHANTEK INFORMATION SYSTEM,2025-02-06,10250.0,24600.0
4500024380,TORRENT TECHNOLOGIES SDN BHD,2025-02-06,85320.0,511920.0
4500024442,BINOR TRADING SDN BHD,2025-02-13,4536.0,9396.0
4500024453,SYARIKAT HUSSAIN CHIK SDN BHD,2025-02-13,6561.64,59054.86
4500024456,SL JAYA & SERVICES CONTRACTOR,2025-02-13,4050.0,35250.0
4500024458,DAYTHREE BUSINESS SERVICES SDN BHD,2025-02-13,1419663.98,3500000.0
4500024528,BAYO PAY (M) SDN BHD,2025-02-20,2986987.8,16200000.0
4500024529,ONG AIRCOND AUTO ACCESSORIES,2025-02-20,650.0,650.0
4500024532,CIDB E-CONSTRUCT SERVICES SDN BHD,2025-02-20,3508.38,50548.38
4500024536,GOAPPS TECHNOLOGY SDN BHD,2025-02-21,39000.0,75450.0
4500024540,RENTOKIL INITIAL (M) SDN BHD,2025-02-21,302.4,3326.4
4500024543,TORRENT TECHNOLOGIES SDN BHD,2025-02-21,89100.0,1069200.0
4500024591,KOPERASI STAF CIDB MALAYSIA BERHAD,2025-02-26,3080.0,400400.0
4500024593,CIDB E-CONSTRUCT SERVICES SDN BHD,2025-02-27,0.0,107236.48
4500024594,CIDB E-CONSTRUCT SERVICES SDN BHD,2025-02-27,0.0,107236.49
4500024595,CIDB E-CONSTRUCT SERVICES SDN BHD,2025-02-27,0.0,138699.0
4500024608,KELAB SUKAN DAN KEBAJIKAN,2025-03-03,360.0,3600.0
4500024611,SAP MALAYSIA SDN. BHD.,2025-03-03,2220.53,445479.21
4500024613,LICENTOKIL (M) SDN. BHD,2025-03-03,800.0,8000.0
4500024625,TSB COPIER SUPPLY,2025-03-05,450.0,4500.0
4500024629,KOPERASI STAF CIDB MALAYSIA BERHAD,2025-03-05,750.4,8600.0
4500024668,PAC INTERNATIONAL ACADEMY SDN BHD,2025-03-11,1950.0,3900.0
4500024669,MICROLAB TECHNOLOGY SDN BHD,2025-03-11,1500.0,5250.0
4500024670,DIGITAL PERAK CORPORATION HOLDINGS,2025-03-11,2400.0,5600.0
4500024686,CIDB E-CONSTRUCT SERVICES SDN BHD,2025-03-13,33159.77,162000.0
4500024696,KOPERASI STAF CIDB MALAYSIA BERHAD,2025-03-13,8780.2,82300.0
4500024697,KOPERASI STAF CIDB MALAYSIA BERHAD,2025-03-13,25130.85,44000.0
4500024737,ANGKASA SOLUTIONS TECHNOLOGY,2025-03-24,5355.0,68850.0
4500024742,DATAXET MALAYSIA SDN. BHD.,2025-03-24,36720.0,110160.0
4500024757,GOKLEEN TRADING & SERVICES SDN BHD,2025-03-25,10886.4,65318.4
4500024759,BUDDY WORKSHOP SDN BHD,2025-03-26,7397.8,7397.8
4500024761,BAIDURI AUTO SDN BHD,2025-03-26,380.55,380.55
4500024764,HEITECH PADU BERHAD,2025-03-26,500656.04,2169509.43
4500024782,UiTM TECHNOVENTURE SDN BHD,2025-03-27,114327.83,428819.96
4500024784,RGBA STUDIO SDN BHD,2025-03-27,0.0,49000.0
4500024803,WORLDLINE SECURITY SERVICES SDN BHD,2025-04-08,40694.4,122083.2
4500024804,KOPERASI STAF CIDB MALAYSIA BERHAD,2025-04-08,5292.0,46452.0
4500024812,WORLD COMMUNICATION NETWORK,2025-04-09,105300.0,105300.0
4500024818,KOPERASI STAF CIDB MALAYSIA BERHAD,2025-04-10,421.2,3697.2
4500024834,SINERGY SOLUTION SDN BHD,2025-04-14,11000.0,59000.0
4500024837,MALAYSIA AIRLINES BERHAD,2025-04-14,0.0,1014.78
4500024898,ABX EXPRESS (M) SDN. BHD.,2025-04-21,382687.14,1457535.94
4500024934,ABI SUFY ENTERPRISE,2025-04-24,8867.0,27300.0
4500024941,ZAAJEL ENSEMBLE & DESIGN,2025-04-25,64500.0,64500.0
4500024974,HUMANOLOGY SDN BHD,2025-05-05,37461.12,249740.82
4500024976,MIBCONS SDN BHD,2025-05-05,155688.92,331328.0
4500024983,PERBADANAN KEMAJUAN PERTANIAN SELAN,2025-05-06,0.13,605838.83
4500024987,INSIGHT MIND SDN BHD,2025-05-07,845.34,10673.34
4500024989,EXAMEDIA SOLUTIONS SDN. BHD,2025-05-07,30000.0,160000.0
4500025047,PURNAMA MAHIR SDN BHD,2025-05-13,846.0,8086.32
4500025115,PUTRAPACK MOVERS SDN. BHD.,2025-05-19,6558.8,40768.6
4500025119,3PLEPIX SDN BHD,2025-05-19,133120.0,314560.0
4500025122,TEKAD MAJU SOLUTIONS SDN BHD,2025-05-19,24228.0,218052.0
4500025145,CIDB IBS SDN. BHD.,2025-05-22,99500.0,199500.0
4500025167,ZAAJEL ENSEMBLE & DESIGN,2025-05-26,25000.0,25000.0
4500025241,TAN CHONG EKSPRES AUTO SERVIS,2025-06-10,0.0,1212.66
4500025259,CIDB E-CONSTRUCT SERVICES SDN BHD,2025-06-11,50400.0,201600.0
4500025264,COWAY (MALAYSIA) SDN BHD,2025-06-12,0.0,4900.0
4500025277,THE MEN'S SHOP,2025-06-12,2700.0,2700.0
4500025329,UFM FACILITIES MANAGEMENT SDN BHD,2025-06-18,1623.24,11362.68
4500025430,SYSTEMATIC COMPETENCY,2025-07-01,0.0,12000.0
4500025438,METRIX RESEARCH SDN BHD,2025-07-01,41040.0,205200.0
4500025454,BIN DAUS ENTERPRISE,2025-07-04,7373.0,44238.0
4500025455,UER RESOURCES SDN BHD,2025-07-04,720.0,2720.0
4500025480,VIRTUAL CALIBRE MSC SDN BHD,2025-07-07,0.0,51840.0
4500025485,DELOITTE BUSINESS ADVISORY SDN. BHD,2025-07-08,216000.0,216000.0
4500025548,UUM LEADS SDN BHD,2025-07-15,82095.0,123142.5
4500025552,KOPERASI STAF CIDB MALAYSIA BERHAD,2025-07-15,10458.0,37350.0
4500025598,G-MART AUTOWORLD SDN BHD,2025-07-21,0.0,9846.5
4500025600,TORRENT TECHNOLOGIES SDN BHD,2025-07-21,11826.0,23652.0
4500025612,BAN HOE SENG (AUTO) SDN BHD,2025-07-22,312.8,312.8
4500025630,MINDA TRAFIK GROUP SDN BHD,2025-07-24,0.0,10000.0
4500025691,GL PARKING SOLUTION SDN BHD,2025-07-31,12084.0,15264.0
4500025699,SYK RESOURCES,2025-08-01,0.0,786.4
4500025701,SYK RESOURCES,2025-08-01,0.0,1276.0
4500025703,EMR CREATIVE SDN BHD,2025-08-01,0.0,48600.0
4500025776,AISY ARSH RESOURCES,2025-08-14,910.0,910.0
4500025798,INVISIGHT PLT,2025-08-18,16200.0,162000.0
4500025826,ZAAJEL ENSEMBLE & DESIGN,2025-08-20,10000.0,10000.0
4500025835,PRICEWATERHOUSECOOPERS ADVISORY,2025-08-20,715883.7,892965.8
4500025856,POHO RUBBER STAMP COMPANY,2025-08-25,960.0,960.0
4500025895,GOAPPS TECHNOLOGY SDN BHD,2025-08-28,18306.0,36612.0
4500025896,INVISIGHT PLT,2025-08-28,90759.53,317658.35
4500025914,SKJ ENGINEERING SDN BHD,2025-09-03,281705.43,469509.05
4500025923,BIO PEST & HYGIENE SDN BHD,2025-09-04,1339.2,5356.8
4500025924,ELERAT COMMUNICATIONS SDN BHD,2025-09-04,0.0,298422.92
4500025942,RENTOKIL INITIAL (M) SDN BHD,2025-09-08,820.99,3283.96
4500025997,TUKANG JAHIT PRESIDEN,2025-09-18,3240.0,3240.0
4500026022,STEVEN THIRU,2025-09-23,76439.06,119856.81
4500026024,INVISIGHT PLT,2025-09-23,85536.0,171072.0
4500026026,PASSION ANTHEM SDN BHD,2025-09-23,0.0,190000.0
4500026029,KOPERASI STAF CIDB MALAYSIA BERHAD,2025-09-23,98040.0,98040.0
4500026037,EXCELLENCE SURVEILLANCE ENTERPRISE,2025-09-23,0.0,6999.0
4500026052,SIGMAPRISE SDN BHD,2025-09-25,12126.0,12126.0
4500026077,MCM ASSOCIATES SDN BHD,2025-09-23,0.0,20000.0
4500026108,NCS SDN BHD,2025-10-01,0.0,2598.9
4500026148,MNAIR PR CONSULTANCY SDN BHD,2025-10-07,65000.0,108000.0
4500026153,ROYAL INSTITUTION OF SURVEYORS,2025-10-07,0.0,46250.0
4500026206,MANDIRI SOLUTION SDN BHD,2025-10-13,0.0,85816.8
4500026232,SUDOERS SOLUTION SDN BHD,2025-10-16,0.0,16650.0
4500026237,KE GLOBAL  VENTURES,2025-10-16,0.0,4980.0
4500026252,CERTO SOLUTIONS SDN BHD,2025-10-17,13020.0,13020.0
4500026260,YaPEIM GOLD SDN. BHD.,2025-10-17,344980.0,344980.0
4500026265,GENERATION SIX SDN BHD,2025-10-21,33831.04,62831.2
4500026267,MCM ASSOCIATES SDN BHD,2025-10-21,0.0,20000.0
4500026275,INSIGHT MIND SDN BHD,2025-10-22,12300.0,16000.0
4500026297,KAPTEN COLOUR LAB,2025-10-23,0.0,4116.0
4500026298,HAZER RESOURCES,2025-10-23,15988.0,15988.0
4500026312,QUBE INTEGRATED MALAYSIA SDN. BHD.,2025-10-27,0.0,5904.9
4500026320,GEMIRIS CONSULTANCY,2025-10-28,38500.0,38500.0
4500026323,ICOMPUCARE GLOBAL SERVICES SDN BHD,2025-10-28,0.0,235980.0
4500026340,WARISAN MAJU EMPIRE SDN BHD,2025-10-30,0.0,1250.0
4500026352,PERCETAKAN KESELAMATAN NASIONAL,2025-10-31,0.0,1925.0
4500026355,VIRTUAL CALIBRE MSC SDN BHD,2025-10-31,0.0,27000.0
4500026366,THE PALACE VENTURES SDN BHD,2025-11-03,0.0,13840.0
4500026369,G-MART AUTOWORLD SDN BHD,2025-11-03,0.0,7137.3
4500026370,G-MART AUTOWORLD SDN BHD,2025-11-03,0.0,787.65
4500026372,G-MART AUTOWORLD SDN BHD,2025-11-03,0.0,11363.55
4500026384,THE BEST ENTERPRISE,2025-11-04,450.0,450.0
4500026388,ANNAS HOLIDAYS SDN BHD,2025-11-04,0.0,2164.97
4500026390,ANNAS HOLIDAYS SDN BHD,2025-11-04,0.0,3246.81
4500026393,ANNAS HOLIDAYS SDN BHD,2025-11-04,0.0,1386.8
4500026395,AKADEMI BINAAN MALAYSIA (UTARA) SDN,2025-11-05,1500.0,1500.0
4500026401,EMR CREATIVE SDN BHD,2025-11-06,9990.0,9990.0
4500026402,TAN CHONG EKSPRES AUTO SERVIS,2025-11-06,3535.25,3535.25
4500026406,DATARAN TEKNIK ENTERPRISE,2025-11-10,0.0,15277.0
4500026415,PERLIS SPECIALIST HOSPITAL,2025-11-11,0.0,1287.0
4500026418,THE STRAITS HOTEL & SUITES SDN BHD,2025-11-11,0.0,11952.0
4500026419,SIME DARBY AUTO CONNEXION SDN BHD,2025-11-11,0.0,5284.65
4500026423,SUCCESS EDGE ACADEMY PLT,2025-11-11,2684.0,2684.0
4500026428,QUBE INTEGRATED MALAYSIA SDN. BHD.,2025-11-11,0.0,798864.89
4500026431,SIRIM QAS INTERNATIONAL SDN BHD,2025-11-11,7526.0,20000.0
4500026438,ATURAN LAGENDA SDN BHD,2025-11-12,13300.0,13300.0
4500026439,EMAR KLASIK RESOURCES,2025-11-12,58010.0,58010.0
4500026440,ETIQA FAMILY TAKAFUL BERHAD,2025-11-12,2328343.12,4359254.18
4500026442,TORRENT TECHNOLOGIES SDN BHD,2025-11-12,0.0,299376.0
4500026446,SYARIKAT SAN SHINE PRINTING SDN BHD,2025-11-12,0.0,761.6
4500026447,OPERASI KUALITI SDN BHD,2025-11-13,0.0,18650.0
4500026448,CERT ACADEMY SDN BHD,2025-11-13,5940.0,5940.0
4500026449,ANNAS HOLIDAYS SDN BHD,2025-11-13,0.0,34593.0
4500026450,NADI BUMI JAYA,2025-11-13,0.0,6600.0
4500026451,EQUAL SIGN SDN BHD,2025-11-13,0.0,11638.0
4500026471,JENDELA SIMFONI SDN BHD,2025-11-18,97500.0,97500.0
4500026472,KOPERASI STAF CIDB MALAYSIA BERHAD,2025-11-18,0.0,458150.0
4500026473,SEJATI ENTERPRISE,2025-11-18,0.0,98670.0
4500026474,IWM GROUP RESOURCES,2025-11-18,19900.0,19900.0
4500026477,FG MEDIA SDN BHD,2025-11-18,28000.0,28000.0
4500026478,SRS KNOWLEDGE FUSION SDN BHD,2025-11-18,0.0,19000.0
4500026482,NATUREL TRADING,2025-11-19,0.0,150.0
4500026484,CHEYAT RESOURCES,2025-11-19,0.0,600.0
4500026485,SEMATAN PALM BEACH RESORT,2025-11-19,0.0,6596.0
4500026488,ASRAF KHAN CARTEL COMPANY,2025-11-19,0.0,600.0
4500026494,NAUTICA INFINITY SDN BHD,2025-11-19,0.0,1666.85
4500026498,SIRIM ACADEMY SDN BHD,2025-11-19,0.0,3754.0
4500026500,RMZ SMART RESOURCES,2025-11-19,27000.0,27000.0
4500026502,PIDATRI TRADING & SUPPLIES,2025-11-20,0.0,1300.0
4500026503,HUBBUN DUNYA SERVICES,2025-11-20,0.0,1050.0
4500026504,TAN CHONG EKSPRES AUTO SERVIS,2025-11-20,0.0,20023.52
4500026505,INNOVATIVE HOLIDAYS SDN. BHD.,2025-11-20,0.0,3960.56
4500026513,JH HOSPITALITY SDN BHD,2025-11-20,5800.0,5800.0
4500026515,KOPERASI STAF CIDB MALAYSIA BERHAD,2025-11-20,0.0,1500.0
4500026522,BAN LEE HENG MOTOR (MELAKA) SDN BHD,2025-11-21,0.0,858.2
4500026523,MITRA KEMBARA SDN BHD,2025-11-21,0.0,2650.0
4500026524,SILA TOUR & TRAVEL SDN BHD,2025-11-21,0.0,2178.0
4500026529,WTC KL HOLDINGS SDN. BHD.,2025-11-24,0.0,40980.0
4500026530,BOUSTEAD HOTELS & RESORTS SDN BHD,2025-11-24,0.0,12820.0
4500026533,BNB ENTERPRISE,2025-11-24,0.0,300.0
4500026535,WINGS BY CROSKE RESORT LANGKAWI,2025-11-24,0.0,60350.0
4500026536,RAZIQA CATERING ENTERPRISE,2025-11-24,0.0,1175.0
4500026543,WE-LINK SDN BHD,2025-11-25,6800.0,6800.0
4500026544,BINTULU MERPATI SDN BHD,2025-11-25,0.0,500.0
4500026545,PALING CONSTRUCTION SDN BHD,2025-11-25,0.0,2750.0
4500026546,HASNUL HADI BIN SUHADI,2025-11-25,0.0,3500.0
4500026547,BOULEVARD MOTOR SDN BHD,2025-11-25,0.0,7747.31
4500026548,THE EDGE COMMUNICATIONS SDN BHD,2025-11-25,443610.0,443610.0
4500026549,CONCORDE HOTEL SHAH ALAM,2025-11-26,25044.0,25044.0
4500026550,CREATIVE ARTWORK,2025-11-26,0.0,2250.0
4500026552,MANDIRI SOLUTION SDN BHD,2025-11-26,161800.0,161800.0
4500026555,KUMPULAN HAMZAH-KWONG HING REALTY,2025-11-26,0.0,13280.0
4500026558,NATUREL TRADING,2025-11-26,0.0,510.0
4500026559,ARENA STABIL SDN BHD,2025-11-26,0.0,9717.0
4500026561,HAMIMI BIN MAJID,2025-11-27,0.0,1500.0
4500026562,MERDEKA WATERFRONT HOTEL SDN BHD,2025-11-27,0.0,7220.0
4500026563,SKILLS TRAINING & CONSULTANCY,2025-11-27,30000.0,30000.0
4500026565,GENERATION SIX SDN BHD,2025-11-28,0.0,254448.0
4500026566,ASRAF KHAN CARTEL COMPANY,2025-11-28,0.0,900.0
4500026567,SYARIKAT J.R.A UTAMA,2025-11-28,0.0,300.0
4500026570,ANNAS HOLIDAYS SDN BHD,2025-12-01,0.0,2817.84
4500026571,ANNAS HOLIDAYS SDN BHD,2025-12-01,0.0,5124.88
4500026572,INNOVATIVE HOLIDAYS SDN. BHD.,2025-12-01,0.0,26096.0
4500026579,HOTEL 77 SDN BHD,2025-12-01,5074.4,5074.4
4500026580,MZR GLOBAL SDN BHD,2025-12-01,16160.0,16160.0
4500026581,OPU GO ENTERTAINMENTS SDN BHD,2025-12-01,49885.2,49885.2
4500026583,JASA INTEGRASI SDN BHD,2025-12-01,10450.0,48550.0
4500026584,PERNIAGAAN OCEAN TEAM,2025-12-01,0.0,39748.0
4500026585,RMZ SMART RESOURCES,2025-12-01,4846.0,4846.0
4500026587,LINGS SIGNATURE COMPANY,2025-12-01,0.0,1095.0
4500026588,IRONSTONE RENOBUILD SDN. BHD.,2025-12-01,0.0,5500.0
4500026589,SILA TOUR & TRAVEL SDN BHD,2025-12-02,0.0,4160.32
4500026590,NUSANTARA DISCOVERY SDN BHD,2025-12-02,0.0,4051.0
4500026591,ANNAS HOLIDAYS SDN BHD,2025-12-02,0.0,3583.02
4500026592,INNOVATIVE HOLIDAYS SDN. BHD.,2025-12-02,0.0,8680.0
4500026593,ANNAS HOLIDAYS SDN BHD,2025-12-02,0.0,4777.86
4500026594,ANNAS HOLIDAYS SDN BHD,2025-12-02,0.0,1596.4
4500026595,ANNAS HOLIDAYS SDN BHD,2025-12-02,0.0,5305.28
4500026596,D JONES HOLIDAYS SDN BHD,2025-12-02,0.0,1593.6
4500026597,KOPERASI STAF CIDB MALAYSIA BERHAD,2025-12-02,0.0,216979.41
4500026598,CHEYAT RESOURCES,2025-12-02,0.0,490.0
4500026599,CHEYAT RESOURCES,2025-12-02,0.0,3750.0
4500026602,GREENLIGHT DESIGN,2025-12-02,27580.0,27580.0
4500026603,BERJAYA HILLS BERHAD,2025-12-02,0.0,10356.5
4500026604,D JONES HOLIDAYS SDN BHD,2025-12-03,0.0,2994.86
4500026605,PERDANA KUALA LUMPUR CITY CENTRE,2025-12-03,0.0,9600.0
4500026606,KERJAYA HOTEL SDN BHD,2025-12-03,35791.0,35791.0
4500026607,PERCETAKAN MESBAH SDN BHD,2025-12-03,9200.0,9200.0
4500026608,MOHAMAD FAISAL BIN ABDUL MALIK,2025-12-03,0.0,19500.0
4500026610,RAZIQA CATERING ENTERPRISE,2025-12-03,0.0,1500.0
4500026611,ZAFPRO ENTERPRISE,2025-12-03,0.0,1310.0
4500026612,KOPERASI STAF CIDB MALAYSIA BERHAD,2025-12-03,0.0,1500.0
4500026617,CIDB HOLDINGS SDN BHD,2025-12-03,0.0,918.0
4500026619,PERABOT CS CHAN SDN BHD,2025-12-03,8590.0,8590.0
4500026620,BOUSTEAD HOTELS & RESORTS SDN. BHD.,2025-12-03,0.0,13200.0
4500026621,AMPANG HOTEL SDN BHD,2025-12-03,0.0,4000.0
4500026623,OG OFFICE AUTOMATION SDN BHD,2025-12-04,0.0,580.0
4500026624,MITRA KEMBARA SDN BHD,2025-12-04,0.0,1230.0
4500026626,D JONES HOLIDAYS SDN BHD,2025-12-04,0.0,5871.17
4500026627,MITRA KEMBARA SDN BHD,2025-12-04,0.0,3000.0
4500026629,SUTERA AUTO SDN BHD,2025-12-05,0.0,714.55
4500026631,TAN CHONG EKSPRES AUTO SERVIS,2025-12-05,0.0,1136.65
4500026632,KELAB REKREASI DAN SUKAN CIDB 23,2025-12-05,0.0,1674.0
4500026635,MH SYNERGY RESOURCES,2025-12-05,0.0,998.0
4500026637,YASFIQ RESOURCES,2025-12-05,10977.8,10977.8
4500026645,PINTAR SEPAKAT TRADING,2025-12-05,0.0,7624.0
4500026646,THE HIDDEN GROVE SEAFOOD,2025-12-05,0.0,1373.75
4500026647,VIMAL AUTO LINER SDN BHD,2025-12-08,0.0,919.45
4500026648,PRISMA TULIN SDN BHD,2025-12-08,19387.4,19387.4
4500026649,CIDB E-CONSTRUCT SERVICES SDN BHD,2025-12-08,0.0,79920.0
4500026650,NAUTICA INFINITY SDN BHD,2025-12-08,252.28,252.28
4500026651,RMS GLOBAL SOLUTION PLT,2025-12-08,16900.0,16900.0
4500026652,HOTEL GRAND PARAGON SDN BHD,2025-12-08,4400.0,4400.0
4500026653,CONCORDE HOTEL SHAH ALAM,2025-12-08,11590.0,11590.0
4500026654,SYC CAPITAL SDN BHD,2025-12-08,0.0,10800.0
4500026655,PINNACLE HOTELS SDN BHD,2025-12-08,0.0,2400.0
4500026656,AZMI & ASSOCIATES,2025-12-08,0.0,121176.0
4500026657,3PLEPIX SDN BHD,2025-12-08,47952.0,47952.0
4500026658,PIXEL BRAIN SDN BHD,2025-12-08,49998.6,49998.6
4500026660,KOPERASI STAF CIDB MALAYSIA BERHAD,2025-12-08,0.0,369980.0
4500026661,FOR-ECH INTEGRATED SDN BHD,2025-12-09,14405.4,14405.4
4500026662,PIDATRI TRADING & SUPPLIES,2025-12-09,7020.0,7020.0
4500026663,JUTA MAJU ENTERPRISE,2025-12-09,0.0,1040.0
4500026664,ZARAMIZ SDN BHD,2025-12-09,49248.0,49248.0
4500026665,CHEYAT RESOURCES,2025-12-10,0.0,350.0
4500026666,GEMIRIS CONSULTANCY,2025-12-10,0.0,17900.0
4500026667,GEMIRIS CONSULTANCY,2025-12-10,0.0,17900.0
4500026668,BUSINESS & BUDGET HOTELS (PENANG),2025-12-10,0.0,14400.0
4500026669,CYBERSECURITY MALAYSIA,2025-12-10,0.0,13500.0
4500026670,ANNAS HOLIDAYS SDN BHD,2025-12-10,0.0,5104.29
4500026671,ANNAS HOLIDAYS SDN BHD,2025-12-10,0.0,2494.88
4500026672,SILA TOUR & TRAVEL SDN BHD,2025-12-10,2335.24,2335.24
4500026677,MITRA KEMBARA SDN BHD,2025-12-10,0.0,1680.0
4500026678,MITRA KEMBARA SDN BHD,2025-12-10,0.0,2400.0
4500026679,INNOVATIVE HOLIDAYS SDN. BHD.,2025-12-10,0.0,1487.0
4500026680,MOTORIA SDN BHD,2025-12-10,0.0,1428.2
4500026681,PRO SALES RESOURCES,2025-12-10,1080.0,1080.0
4500026682,BORNEO MOBILITY (SARAWAK) SDN BHD,2025-12-11,0.0,1238.7
4500026683,BORNEO MOBILITY (SARAWAK) SDN BHD,2025-12-11,0.0,1097.14
4500026684,ALISHA ENTERPRISE,2025-12-11,800.0,800.0
4500026685,RAZIQA CATERING ENTERPRISE,2025-12-11,0.0,800.0
4500026686,WOODSTOCK CAMP SDN. BHD.,2025-12-11,15525.43,15525.43
4500026687,WTC KL HOLDINGS SDN. BHD.,2025-12-11,54400.0,54400.0
4500026688,RAZIQA CATERING ENTERPRISE,2025-12-11,1500.0,1500.0
4500026689,ALISHA ENTERPRISE,2025-12-12,770.0,770.0
4500026690,SERI PACIFIC CORPORATION SDN. BHD.,2025-12-12,16675.2,16675.2
4500026692,LESTARI VENTURES ENGINEERING,2025-12-12,97425.0,97425.0
4500026694,DZKIR ENGINEERING ENTERPRISE,2025-12-12,0.0,118378.24
4500026695,NAUTICA INFINITY SDN BHD,2025-12-12,2042.62,2042.62
4500026696,SUKNOTRA ENTERPRISE,2025-12-14,10000.0,10000.0
4500026697,MITRA KEMBARA SDN BHD,2025-12-15,0.0,1880.0
4500026698,MITRA KEMBARA SDN BHD,2025-12-15,0.0,1060.0
4500026699,D JONES HOLIDAYS SDN BHD,2025-12-15,2586.86,2586.86
4500026703,TAN CHONG EKSPRES AUTO SERVIS,2025-12-15,1475.2,1475.2
4500026705,BAN LEE HENG MOTOR SDN BHD,2025-12-15,108.0,108.0
4500026706,BAN LEE HENG MOTOR SDN BHD,2025-12-15,223.3,223.3
4500026708,ACETREND CORPORATION SDN BHD,2025-12-15,12819.6,12819.6
4500026709,UTM HOLDINGS SDN BHD,2025-12-15,39412.0,39412.0
4500026710,RUZIANAS RICH RESOURCES,2025-12-15,10440.0,10440.0
4500026712,SAI EZEE NETWORK,2025-12-15,19980.0,19980.0
4500026713,CREATE FRENZY RESOURCES,2025-12-15,19900.0,19900.0
4500026714,MALAYSIAN PRESS INSTITUTE,2025-12-15,80000.0,80000.0
4500026715,ELERAT COMMUNICATIONS SDN BHD,2025-12-15,170701.0,170701.0
4500026716,M RESORT & HOTEL SDN BHD,2025-12-15,67050.0,67050.0
4500026717,MARITIME WATERFRONT SUITES SDN BHD,2025-12-15,7992.0,7992.0
4500026719,CIDB HOLDINGS SDN BHD,2025-12-16,0.0,120000.0
4500026720,JURUTERA BUDIMAN (M&E) SDN BHD,2025-12-17,7344.0,39528.0
4500026721,J. B. BERGABUNG,2025-12-17,0.0,17110.44
4500026722,FIRAZ CONSTRUCTION,2025-12-17,0.0,180232.0
4500026723,OMNI PROJECT CONSULTANCY SDN BHD,2025-12-17,0.0,38507.4
4500026724,RAZIN ARCHITECHS SDN BHD,2025-12-17,0.0,78732.0
4500026725,UMP HOLDINGS SDN BHD,2025-12-17,161241.84,161241.84
4500026726,NUSANKOM SDN BHD,2025-12-17,4976.64,4976.64
4500026727,MITRA KEMBARA SDN BHD,2025-12-17,0.0,2710.0
4500026728,MITRA KEMBARA SDN BHD,2025-12-17,0.0,1430.0
4500026729,D JONES HOLIDAYS SDN BHD,2025-12-17,4239.38,4239.38
4500026730,EXAMEDIA SOLUTIONS SDN. BHD,2025-12-17,0.0,399645.79
4500026731,ATURAN LAGENDA SDN BHD,2025-12-17,10000.0,10000.0
4500026732,EYES FORWARD SDN BHD,2025-12-18,39850.0,39850.0
4500026733,KOPERASI STAF CIDB MALAYSIA BERHAD,2025-12-18,54260.8,54260.8
4500026734,WS NETWORK TECHNOLOGIES SDN BHD,2025-12-18,0.0,349231.76
4500026735,TEKAD MAJU SOLUTIONS SDN BHD,2025-12-18,0.0,92880.0
4500026736,RAZIQA CATERING ENTERPRISE,2025-12-18,3150.0,3150.0
4500026737,MINDA TRAFIK GROUP SDN BHD,2025-12-18,0.0,6500.0
4500026738,CONSTRUCTION RESEARCH INSTITUTE,2025-12-19,0.0,187150.0
4500026739,ANNAS HOLIDAYS SDN BHD,2025-12-19,5025.08,5025.08
4500026740,SILA TOUR & TRAVEL SDN BHD,2025-12-19,4114.48,4114.48
4500026741,SILA TOUR & TRAVEL SDN BHD,2025-12-19,3815.16,3815.16
4500026742,ANNAS HOLIDAYS SDN BHD,2025-12-19,0.0,2256.24
4500026743,INNOVATIVE HOLIDAYS SDN. BHD.,2025-12-19,4345.12,4345.12
4500026744,ANNAS HOLIDAYS SDN BHD,2025-12-19,0.0,855.44
4500026745,R & D CONSTRUCTION SDN BHD,2025-12-19,3267008.76,3267008.76
4500026746,PUBM QUANTITY SURVEYORS SDN BHD,2025-12-19,817289.45,817289.45
4500026747,K.T.I SDN BHD,2025-12-19,1836150.0,1836150.0
4500026748,K.T.I SDN BHD,2025-12-19,2850000.0,2850000.0
4500026749,CHAN & SHAHRIMAN ARKITEK SDN BHD,2025-12-19,1994850.91,1994850.91
